uuid,item,page_category,primary_keywords,secondary_keywords,long_tail_keywords,local_seo_terms,priority,search_volume,competition
492c5438-2401-4c26-8695-9ce66f108079,1,Homepage,"Kingman theater, Beale Street Theater, live performance Kingman AZ","community arts Kingman, things to do downtown Kingman, performing arts Arizona","live theater shows in Kingman Arizona, community theater downtown Kingman, where to see live performances Kingman","theater near me Kingman, live shows Kingman AZ, entertainment downtown Kingman",High,Medium,Low
e334ca5e-0e71-4a5f-b8ef-e913c7318ba9,2,Shows/Tickets,"buy theater tickets Kingman, Beale Street Theater tickets, get tickets Kingman shows","live shows Kingman AZ, theater events Kingman, performing arts tickets Arizona","where to buy theater tickets in Kingman, community theater tickets Kingman Arizona, upcoming shows Beale Street Theater","theater tickets near me, Kingman show tickets, live performance tickets Kingman",High,Medium-High,Low-Medium
66e9b2d9-c6d2-4c11-9685-9d95091c289e,3,Community Theater,"community theater Kingman, acting classes Kingman AZ, theater auditions Kingman","volunteer theater Kingman, adult acting workshops Arizona, community plays Kingman","how to join community theater in Kingman, acting classes for adults Kingman Arizona, community theater auditions near me","theater classes near me Kingman, acting workshops Kingman AZ, community theater groups Kingman",Medium,Low-Medium,Low
b82b41b3-b143-4f44-9edd-64e3f7289016,4,Youth Theater,"youth theater Kingman, teen acting programs Arizona, theater classes for kids Kingman","youth productions Kingman AZ, theater programs for teens, kids acting classes Arizona","theater programs for teenagers in Kingman, youth acting classes Kingman Arizona, kids theater summer programs near Kingman","youth theater near me, kids acting classes Kingman, teen theater programs Kingman AZ",Medium,Medium,Low
745d5e57-2501-42a9-b839-6b332819c80c,5,Support/Donate,"donate to Beale Street Theater, sponsor theater Kingman, support community arts","theater sponsorship opportunities, adopt a seat program, nonprofit theater donations","how to donate to theater in Kingman, sponsorship opportunities Beale Street Theater, adopt a seat theater program Kingman","support local theater Kingman, donate to arts Kingman AZ, theater fundraising Kingman",Medium,Low,Low
14575907-95ab-47d1-ab9e-450baef1cd88,6,About/History,"Beale Street Theater history, historic theater Kingman, State Theater Kingman Arizona","Kingman performing arts venue, theater renovation Kingman, historic downtown Kingman","history of State Theater in Kingman Arizona, Beale Street Theater renovation story, historic theaters along Route 66","historic venues Kingman AZ, downtown Kingman landmarks, Route 66 theaters Arizona",Low-Medium,Low,Very Low
